{
  "job_id": "22222222-2222-4222-8222-222222222222",
  "lane": "self",
  "intent": "build",
  "worker": "claude",
  "model_profile": "default",
  "task": "Add a harmless file, but this fixture intentionally omits write context.",
  "context": {},
  "permissions": {
    "tier": "write_sandboxed",
    "write": ["README.md"],
    "deny": [".env*", "secrets/**"],
    "network": false,
    "git_push": false
  },
  "verify": {"tests": null, "lint": false},
  "budget": {"max_minutes": 10, "max_tokens": 20000}
}
